,index,title,date,hazard,hazard_type,recall_class,audience,distribution,brand,company,product
879,1262,"""Nutty Club"" brand Sliced Brazils recalled due to aflatoxin",2018-02-16,Aflatoxin,Chemical,Class 3,Retail,"Alberta, British Columbia, Manitoba, Ontario, Saskatchewan","""Nutty Club""",Scott Bathgate Ltd.,Sliced brazils
880,1260,Certain brands of protein bars recalled due to pieces of metal,2018-02-16,Metal,Extraneous Material,Class 2,Retail,Nationally,Certain,Pro-Amino International Inc.,Of protein bars
881,1258,Danny's Pizza Brand Products Containing Garlic Fingers recalled due to undeclared milk,2018-02-16,Milk,Allergen,Class 2,Retail,Nationally,,Woodhaven Enterprises Ltd.,Products containing garlic fingers
882,1259,Genuine Health brand protein bars recalled due to pieces of metal,2018-02-16,Metal,Extraneous Material,Class 2,Retail,Nationally,Genuine Health,Genuine Health Inc.,Protein bars
883,1263,Paldo brand Seaweed Snack products and Lotte brand Kancho Choco Biscuit recalled due to undeclared peanut,2018-02-13,Peanut,Allergen,Class 1,Retail,Nationally,Paldo,Canda Six Fortune Enterprise Co. Ltd.,Seaweed snack products and lotte brand kancho choco biscuit
884,1264,KJ brand Sweet & Sour Chicken with Rice and Sesame Chicken with Rice recalled due to undeclared milk,2018-02-09,Milk,Allergen,Class 1,Retail,Ontario,KJ,K.J. Foods Inc.,Sweet & sour chicken with rice and sesame chicken with rice
885,1265,No Name Brand Popping Corn recalled due to presence of insects,2018-02-09,Insects,Extraneous Material,Class 3,Retail,Nationally,,Loblaw Companies Limited,Popping corn
886,1266,Weins brand Real Mayonnaise recalled due to mould,2018-02-09,Mould,Microbiological,Class 3,Hotel/Restaurant/Institutional,"Ontario, Quebec",Weins,Aliments Weins Foods,Real mayonnaise
887,1267,Sawler brand Turnip Sticks and Compliments brand Baby Cut Turnip Sticks recalled due to Listeria monocytogenes,2018-02-08,Listeria monocytogenes,Microbiological,Class 1,Retail,Nationally,Sawler,Sawler Gardens Ltd.,Turnip sticks and compliments brand baby cut turnip sticks
888,1269,Araliya brand Thala Aluwa recalled due to undeclared wheat,2018-02-07,Wheat,Allergen,Class 3,Retail,"Alberta, British Columbia, Ontario, Quebec",Araliya,Premi Foods Ltd.,Thala aluwa
889,1268,KJ brand Sweet & Sour Chicken with Rice and Sesame Chicken with Rice recalled due to possible harmful bacteria,2018-02-07,Quality/Spoilage,Microbiological,Class 2,Retail,Ontario,KJ,K.J. Foods Inc.,Sweet & sour chicken with rice and sesame chicken with rice
890,1270,Great Value Popping Corn recalled due to presence of insects,2018-02-06,Insects,Extraneous Material,Class 3,Retail,Nationally,,Walmart Canada Corp.,To presence of insects
891,1271,"Powdered Almond & Yam Drink with Walnut recalled by Canada Volumes Import/Export Inc. due to undeclared gluten, milk and wheat",2018-02-02,"Gluten, milk , wheat",Allergen,Class 2,"Retail, Retail","British Columbia, Manitoba, British Columbia, Manitoba",,Canada Volumes Import/Export Inc.,"To undeclared gluten, milk and wheat"
892,1272,"Daisho brand ""Seasoned Soup Base for Pot (Kimuchi Nabe Soup)"" recalled due to undeclared shrimp and crab",2018-02-02,"Shrimp , crab",Allergen,Class 1,Retail,"Alberta, British Columbia, Manitoba, Ontario, Quebec",Daisho,JFC International (Canada) Inc.,"""seasoned soup base for pot (kimuchi nabe soup)"""
893,1273,Tavora brand and Alianca brand Butterfly breaded shrimp and VistaMar brand Gourmet breaded shrimp recalled due to undeclared egg,2018-02-01,Egg,Allergen,Class 1,Consumer,"Ontario, Quebec",Tavora,Valenca Importers & Exporters Ltd.,And alianca brand butterfly breaded shrimp and vistamar brand gourmet breaded shrimp
894,1274,Imperial Caviar & Seafood brand and VIP Caviar Club brand Whitefish and Salmon Roe recalled due to potential presence of dangerous bacteria,2018-02-01,Dangerous bacteria,Microbiological,Class 1,Retail,Nationally,Imperial Caviar & Seafood,Imperial Caviar & Seafood,And vip caviar club brand whitefish and salmon roe
895,1275,Sawler brand Turnip Sticks recalled due to Listeria monocytogenes,2018-01-31,Listeria monocytogenes,Microbiological,Class 1,Retail,"Alberta, British Columbia, Prince Edward Island, Manitoba, New Brunswick, Nova Scotia, Saskatchewan, Newfoundland and Labrador",Sawler,Sawler Gardens Ltd.,Turnip sticks
896,1276,Campitello brand Sheep's Milk Cheese (Semi-Soft Ripened) recalled due to E. coli,2018-01-30,E. coli,Microbiological,Class 2,Retail,"British Columbia, Manitoba, Ontario, Quebec, Saskatchewan",Campitello,Berchicci Importing Ltd.,Sheep's milk cheese (semi-soft ripened)
897,1278,Coconut Tree brand Shredded Young Coconut recalled due to Salmonella,2018-01-29,Salmonella,Microbiological,Class 2,"Retail, Retail","Prince Edward Island, Ontario, Quebec, Prince Edward Island, Ontario, Quebec",Coconut Tree,Thai Indochine Trading Inc.,Shredded young coconut
898,1279,"Farmers, Natrel and Northumberland brand milk and cream products recalled due to presence of sanitizer",2018-01-29,Sanitizer,Chemical,Class 3,"Retail, Hotel/Restaurant/Institutional","Prince Edward Island, New Brunswick, Nova Scotia, Newfoundland and Labrador","Farmers, Natrel and Northumberland",Agropur Cooperative,Milk and cream products
899,1277,Bhugga sold at Rajdhani Sweets & Restaurant recalled due to Salmonella,2018-01-29,Salmonella,Microbiological,Class 2,"Retail, Retail","Ontario, Ontario",,Rajdhani Sweets & Restaurant,To salmonella
900,1281,Imperial Caviar & Seafood brand and VIP Caviar Club brand Whitefish Roe recalled due to potential presence of dangerous bacteria,2018-01-27,Dangerous bacteria,Microbiological,Class 1,Retail,Nationally,Imperial Caviar & Seafood,Imperial Caviar & Seafood,And vip caviar club brand whitefish roe
901,1282,IHF brand sesame seeds recalled due to Salmonella,2018-01-26,Salmonella,Microbiological,Class 2,Retail,Ontario,IHF,Iqbal Halal Foods,Sesame seeds
902,1283,HelloFRESH brand sesame seeds recalled due to Salmonella,2018-01-26,Salmonella,Microbiological,Class 2,Retail,"Alberta, British Columbia, Manitoba, Saskatchewan",HelloFRESH,HelloFRESH,Sesame seeds
903,1284,Certain sesame seeds recalled due to Salmonella,2018-01-25,Salmonella,Microbiological,Class 2,Consumer,Ontario,,"ARZ Fine Foods, Bulk Food Stop Inc.",Sesame seeds
904,1285,Various brands of coconut products recalled due to Salmonella,2018-01-24,Salmonella,Microbiological,Class 2,Retail,Nationally,Various,"Hen Long Market Oriental Food Co. Ltd., Thai United Food Trading Ltd., Three Dolphins Wholesale",Of coconut products
905,1286,Various brands of Raw Sesame Seeds recalled due to Salmonella,2018-01-24,Salmonella,Microbiological,Class 2,Hotel/Restaurant/Institutional,Nationally,Various,David Roberts Food Corporation,Of raw sesame seeds
906,1288,Various brands of juice products recalled due to off odour,2018-01-23,Quality/Spoilage,Other,Class 3,"Retail, Hotel/Restaurant/Institutional","New Brunswick, Nova Scotia, Ontario, Quebec, Newfoundland and Labrador",Various,A. Lassonde Inc.,Of juice products
907,1289,Naturally Good brand Hulled Sesame Seeds recalled due to Salmonella,2018-01-23,Salmonella,Microbiological,Class 2,Hotel/Restaurant/Institutional,"Alberta, New Brunswick, Ontario",Naturally Good,North American Impex,Hulled sesame seeds
908,1290,Imperial Caviar & Seafood brand Whitefish Roe recalled due to potential presence of dangerous bacteria,2018-01-19,Dangerous bacteria,Microbiological,Class 1,"Retail, Retail",Nationally,Imperial Caviar & Seafood,Imperial Caviar & Seafood,Whitefish roe
909,1291,Te Chang Food brand tofu products recalled due to undeclared peanut and sesame,2018-01-19,"Peanut , sesame",Allergen,Class 1,Retail,Nationally,Te Chang Food,"Canda Six Fortune Enterprise Co. Ltd., Green4U Products Ltd., Kuo Hua Trading Company Ltd.",Tofu products
910,1292,"Maison du Pain brand ""Salade de macaroni"" recalled due to undeclared milk",2018-01-18,Milk,Allergen,Class 3,Retail,Quebec,Maison du Pain,2164-2061 Québec Inc.,"""salade de macaroni"""
911,1293,Mehwish brand Gachak recalled due to undeclared almonds and sesame seeds,2018-01-18,"Almonds , sesame",Allergen,Class 3,Retail,Ontario,Mehwish,Mehwish & Mashmoom International,Gachak
912,1294,Liu Bi Hu brand Sweet Bean Paste recalled due to undeclared soy,2018-01-16,Soy,Allergen,Class 2,Retail,Ontario,Liu Bi Hu,J. L. Trading Co. Ltd.,Sweet bean paste
913,1295,The Village Cheese Company brand Raw Milk Cheddar Cheese recalled due to a toxin produced by Staphylococcus bacteria,2018-01-15,Staphylococcus aureus,Microbiological,Class 2,Retail,"Alberta, British Columbia, Yukon",The Village Cheese Company,Kikumbia Pharmaceuticals Ltd.,Raw milk cheddar cheese
914,1296,Ottogi brand Soup Products recalled due to undeclared milk,2018-01-12,Milk,Allergen,Class 2,Retail,"Ontario, Quebec",Ottogi,Korea Food Trading,Soup products
915,1297,Imperial Caviar & Seafood / VIP Caviar Club brands Golden Whitefish Roe / Whitefish Roe recalled due to potential presence of dangerous bacteria,2018-01-12,Dangerous bacteria,Microbiological,Class 1,Retail,Quebec,Imperial Caviar & Seafood / VIP Caviar Club,Imperial Caviar & Seafood,Golden whitefish roe / whitefish roe
916,1299,Imperial Caviar & Seafood / VIP Caviar Club* brands Golden Whitefish Roe / Whitefish Roe* due to potential presence of dangerous bacteria,2018-01-11,Dangerous bacteria,Microbiological,Class 1,Retail,Quebec,Imperial Caviar & Seafood / VIP Caviar Club*,Imperial Caviar & Seafood,To potential presence of dangerous bacteria
917,1300,Ottogi brand Beef Bone and Vegetable Soup recalled due to undeclared milk,2018-01-11,Milk,Allergen,Class 2,Retail,Ontario,Ottogi,Lemond Food Corp.,Beef bone and vegetable soup
918,1301,Smithfield brand pork tenderloin recalled due to presence of desoxycarbadox,2018-01-11,Desoxycarbadox,Chemical,Class 2,Retail,Alberta,Smithfield,Export Packers Company Ltd.,Pork tenderloin
919,1302,Imperial Caviar & Seafood brand Whitefish Roe and VIP Caviar Club brand Salmon Roe recalled due to potential presence of dangerous bacteria,2018-01-10,Dangerous bacteria,Microbiological,Class 1,Retail,Nationally,Imperial Caviar & Seafood,Imperial Caviar & Seafood,Whitefish roe and vip caviar club brand salmon roe
920,1303,Te Chang Food brand Towfu (Bean Curd) Cake (Barbecue Flavor) recalled due to undeclared peanuts and sesame,2018-01-10,"Peanuts , sesame",Allergen,Class 1,Retail,British Columbia,Te Chang Food,Green4U Products Ltd.,Towfu (bean curd) cake (barbecue flavor)
921,1304,Farmer's Market brand Rhubarb Strawberry Pie recalled due to pieces of plastic,2018-01-09,Plastic,Extraneous Material,Class 3,Retail,Nationally,Farmer's Market,Loblaw Companies Limited,Rhubarb strawberry pie
922,1305,Kirkland Signature brand All Butter Croissants recalled from certain stores due to possible presence of plastic,2018-01-06,Plastic,Extraneous Material,Class 2,Retail,Ontario,Kirkland Signature,Costco Wholesale Canada Ltd.,All butter croissants
923,1306,Soy Complete brand Plant-Based Protein Shake – Vanilla recalled due to undeclared milk,2018-01-05,Milk,Allergen,Class 1,Retail,Nationally,Soy Complete,Healthy Body Services,Plant-based protein shake – vanilla
924,1307,PC brand Sweet Chipotle Prepared Mustard may be unsafe due to possible presence of glass,2018-01-05,Glass,Extraneous Material,Class 1,Retail,Nationally,PC,Loblaw Companies Limited,Sweet chipotle prepared mustard
925,1309,Por Kwan brand Nuoc Me Chua Tamarind Concentrate recalled due to presence of stones,2018-01-04,Stones,Extraneous Material,Class 2,Retail,"Alberta, Manitoba, Saskatchewan",Por Kwan,Dong Phuong Distributor,Nuoc me chua tamarind concentrate
926,1308,Old Country Sausage Shop brand Grass Fed Bison Pepperoni Sticks recalled due to pieces of metal,2018-01-04,Metal,Extraneous Material,Class 3,Retail,Alberta,Old Country Sausage Shop,Old Country Sausage,Grass fed bison pepperoni sticks
927,1311,Various brands of sandwich products recalled due to Listeria monocytogenes,2017-12-28,Listeria monocytogenes,Microbiological,Class 1,Retail,Nationally,Various,HQ Fine Foods,Of sandwich products
928,1312,Selection brand Popping Corn recalled due to presence of insects,2017-12-27,Insects,Extraneous Material,Class 3,Retail,Nationally,Selection,Metro Brands,Popping corn
929,1313,Farm Boy brand Milk Chocolate Covered Double Roasted Almonds recalled due to undeclared peanuts,2017-12-22,Peanuts,Allergen,Class 2,Retail,Ontario,Farm Boy,Farm Boy,Milk chocolate covered double roasted almonds
930,1314,Polly Ann brand frozen dessert bars recalled due to undeclared milk,2017-12-21,Milk,Allergen,Class 1,Retail,Nationally,Polly Ann,Bayan Grocers Inc.,Frozen dessert bars
931,1317,Ottogi brand Beef Bone and Vegetable Soup recalled due to undeclared milk,2017-12-19,Milk,Allergen,Class 2,Retail,"Alberta, British Columbia, Manitoba, Saskatchewan",Ottogi,Seoul Trading Corporation,Beef bone and vegetable soup
932,1318,President's Choice brand breaded shrimp products recalled due to undeclared egg,2017-12-19,Egg,Allergen,Class 1,Retail,Nationally,President's Choice,Loblaw Companies Limited,Breaded shrimp products
933,1320,Imperial Caviar & Seafood and VIP Caviar Club brand Trout Roe recalled due to potential presence of dangerous bacteria,2017-12-15,Dangerous bacteria,Microbiological,Class 1,Retail,"Ontario, Quebec",Imperial Caviar & Seafood and VIP Caviar Club,Imperial Caviar & Seafood,Trout roe
934,1324,Xin Rui Food brand Pork Meatball with Shii-Take Homestyle recalled due to pieces of plastic,2017-12-11,Plastic,Extraneous Material,Class 3,Retail,Ontario,Xin Rui Food,Xin Rui Food Co. Ltd.,Pork meatball with shii-take homestyle
935,1321,Wang Zhong Wan brand Fishball with Meat recalled due to undeclared egg,2017-12-11,Egg,Allergen,Class 3,Retail,Ontario,Wang Zhong Wan,Wang Zhong Wan,Fishball with meat
936,1323,Radhuni brand Vermicelli recalled due to undeclared wheat,2017-12-11,Wheat,Allergen,Class 3,Retail,Ontario,Radhuni,Oshin International Inc.,Vermicelli
937,1325,Gesas brand Turkish Halva recalled due to presence of pistachios and sesame seeds,2017-12-11,"Pistachios , sesame",Allergen,Class 3,Retail,"Manitoba, Ontario",Gesas,Pristine Promotions Ltd.,Turkish halva
938,1322,Vinh Thuan brand Hagou Flour recalled due to undeclared gluten,2017-12-11,Gluten,Allergen,Class 3,Retail,"Alberta, British Columbia",Vinh Thuan,Thai United Food Trading Ltd.,Hagou flour
939,1326,VIP Caviar Club brand Trout Roe recalled due to potential presence of dangerous bacteria,2017-12-09,Dangerous bacteria,Microbiological,Class 1,Retail,Quebec,VIP Caviar Club,Imperial Caviar & Seafood,Trout roe
940,1327,Sensations brand Cinnamon Roll Uncooked Dough recalled due to undeclared pecans,2017-12-08,Pecans,Allergen,Class 3,Retail,"Prince Edward Island, New Brunswick, Nova Scotia, Ontario, Newfoundland and Labrador",Sensations,Sobeys Inc.,Cinnamon roll uncooked dough
941,1328,Ottogi brand soup recalled due to undeclared milk,2017-12-08,Milk,Allergen,Class 2,Retail,"Alberta, British Columbia, Manitoba",Ottogi,T-Brothers Food And Trading Ltd.,Soup
942,1329,Pfenning's Organic Vegetables Inc. brand Carrot Juicer recalled due to pieces of metal,2017-12-06,Metal,Extraneous Material,Class 3,Retail,Ontario,Pfenning's Organic Vegetables Inc.,Pfenning's Organic Vegetables Inc.,Carrot juicer
943,1330,Kasanda brand Liquid Pasteurized Kurd recalled due to undeclared milk,2017-12-06,Milk,Allergen,Class 3,Retail,"Alberta, British Columbia, Ontario",Kasanda,Persia Foods,Liquid pasteurized kurd
944,1332,Compliments Naturally Simple brand Angle Hair Nests recalled due to presence of insects,2017-12-01,Insects,Extraneous Material,Class 3,Retail,"Nova Scotia, Ontario, Quebec",Compliments Naturally Simple,Les Aliments O Sole Mio Inc.,Angle hair nests
945,1333,Anthon Berg brand Sweet Moments Marzipan Bar Mini recalled due to pieces of plastic,2017-11-30,Plastic,Extraneous Material,Class 3,Retail,Ontario,Anthon Berg,Concord Sales Ltd.,Sweet moments marzipan bar mini
946,1334,Produit Pita Achtarout brand Madeleines Tea Cakes recalled due to undeclared milk,2017-11-28,Milk,Allergen,Class 2,Retail,Quebec,Produit Pita Achtarout,Produit Pita Achtarout,Madeleines tea cakes
947,1335,Verger Pedneault brand Fruit Butters recalled due to undeclared milk,2017-11-28,Milk,Allergen,Class 2,Retail,Quebec,Verger Pedneault,Pépinère et Verger Pedneault et Frères Inc.,Fruit butters
948,1337,Alvita brand Biscuits recalled due to undeclared egg,2017-11-24,Egg,Allergen,Class 3,Retail,"Alberta, British Columbia, Ontario",Alvita,Delta Country Farms (BC) Ltd.,Biscuits
949,1338,AKI brand Chum Salmon Caviar recalled due to potential presence of dangerous bacteria,2017-11-24,Dangerous bacteria,Microbiological,Class 1,Consumer,Nationally,AKI,International House of Caviar Ltd.,Chum salmon caviar
950,1339,Agropur Signature - Oka brand Oka Cheese Fondue recalled due to undeclared milk and wheat,2017-11-23,"Milk , wheat",Allergen,Class 3,Retail,"Ontario, Quebec",Agropur Signature - Oka,Agropur Coopérative,Oka cheese fondue
951,1340,Lebon brand Chicken Noodle Soup recalled due to swelling cans,2017-11-22,Swelling cans,Microbiological,Class 3,Retail,Quebec,Lebon,9311-5947 Québec Inc.,Chicken noodle soup
952,1341,Cartwright & Butler brand Black Cherry Preserve recalled due to mould,2017-11-20,Mould,Microbiological,Class 3,Retail,"Alberta, British Columbia, Manitoba, Nova Scotia, Ontario, Quebec, Northwest Territories",Cartwright & Butler,Dovetale Collections,Black cherry preserve
953,1343,Zinda brand Pilaf with Vegetables Couscous recalled due to presence of insects,2017-11-17,Insects,Extraneous Material,Class 3,Retail,Quebec,Zinda,Produits Zinda Canada Inc.,Pilaf with vegetables couscous
954,1342,Yeshu brand Coconut Palm Juice recalled due to undeclared milk,2017-11-17,Milk,Allergen,Class 2,Retail,Ontario,Yeshu,Five Continents International Ltd.,Coconut palm juice
955,1345,Agropur Import Collection brand Firm Ripened Comté Cheese recalled due to Listeria monocytogenes,2017-11-12,Listeria monocytogenes,Microbiological,Class 1,Retail,Nationally,Agropur Import Collection,Agropur Cooperative,Firm ripened comté cheese
956,1346,Vinh Thuan brand Rice Flour for Cake recalled due to undeclared gluten,2017-11-10,Gluten,Allergen,Class 3,Retail,"Alberta, British Columbia, Saskatchewan",Vinh Thuan,Thai United Food Trading Ltd.,Rice flour for cake
957,1347,"Good For You Snacks Ltd. brand Corn Snack products recalled due to undeclared milk, soy and wheat",2017-11-10,"Milk, soy , wheat",Allergen,Class 1,Consumer,"Alberta, Saskatchewan",Good For You Snacks Ltd.,Good For You Snacks Ltd.,Corn snack products
958,1348,Ground Lean Veal recalled due to E. coli O157:H7,2017-11-08,E. coli o157:h7,Microbiological,Class 1,Retail,Retail,,Ontario,To e. coli o157:h7
959,1349,"Cavendish Farms brand 1/4"" X-Ring Onion Rings Crispy Tempura recalled due to undeclared milk",2017-11-07,Milk,Allergen,Class 1,Hotel/Restaurant/Institutional,Nationally,Cavendish Farms,Cavendish Farms Corporation,"1/4"" x-ring onion rings crispy tempura"
960,1350,Earth Teaze brand Pure Peppermint Finest Herbal Tea Blend and Pure Chamomile Finest Herbal Tea Blend recalled due to presence of insects,2017-11-06,Insects,Extraneous Material,Class 3,Retail,Nationally,Earth Teaze,Or'Gourmet Inc.,Pure peppermint finest herbal tea blend and pure chamomile finest herbal tea blend
961,1352,"Radeberger brand, Schofferhofer brand and Dab brand beer recalled due to potential off-odor and off-taste",2017-11-03,Quality/Spoilage,Microbiological,Class 3,Retail,"Manitoba, Nova Scotia, Ontario",Radeberger,Premier Brands Ltd.,And dab brand beer
962,1353,Anthon Berg brand Cognac Marzipan Bar recalled due to pieces of plastic,2017-11-03,Plastic,Extraneous Material,Class 3,Warehouse,British Columbia,Anthon Berg,Concord Sales Ltd.,Cognac marzipan bar
963,1354,True North Seafood Company brand Toppers Smoked Salmon Flakes seasoned with lemon and dill recalled due to Listeria monocytogenes,2017-11-03,Listeria monocytogenes,Microbiological,Class 1,Consumer,Nationally,True North Seafood Company,True North Salmon Co.  Ltd.,Toppers smoked salmon flakes seasoned with lemon and dill
964,1355,Christie brand Honey Teddy Grahams recalled due to rancidity,2017-11-03,Quality/Spoilage,Other,Class 3,Retail,Nationally,Christie,Mondelez Canada Inc.,Honey teddy grahams
965,1356,Maple Leaf brand Chicken Breast Strips recalled due to a toxin produced by Staphylococcus bacteria,2017-11-01,Staphylococcus aureus,Microbiological,Class 2,Retail,Nationally,Maple Leaf,Maple Leaf Foods,Chicken breast strips
966,1358,Circle K Favourites brand Dark Chocolate Covered Almonds recalled due to undeclared milk,2017-10-31,Milk,Allergen,Class 1,Retail,"New Brunswick, Nova Scotia, Prince Edward Island, Newfoundland and Labrador",Circle K Favourites,Couche-Tard Inc.,Dark chocolate covered almonds
967,1359,Mac's Favorites brand dark chocolate covered almonds recalled due to undeclared milk,2017-10-30,Milk,Allergen,Class 1,Retail,Nationally,Mac's Favorites,Mac's Convenience Stores Inc.,Dark chocolate covered almonds
968,1360,Scarpone's brand Polenta recalled due to non-food grade ink,2017-10-27,Non-food grade ink,Other,Class 3,Warehouse,"Alberta, British Columbia, Manitoba, Ontario, Saskatchewan",Scarpone's,Great West Italian Importers,Polenta
969,1362,Various brands of polenta recalled by Bosa Foods due to non-food grade ink,2017-10-27,Non-food grade ink,Other,Class 3,Warehouse,British Columbia,Various,Bosa Foods,Of polenta
970,1361,Whole Foods Market brand Spinach Feta Stuffed Chicken Breast from one store recalled due to undeclared walnut,2017-10-27,Walnut,Allergen,Class 1,Retail,Ontario,Whole Foods Market,Whole Foods Market (Oakville),Spinach feta stuffed chicken breast from one store
971,1364,Longos brand Café Latte Biscotti recalled due to undeclared almonds,2017-10-26,Almonds,Allergen,Class 3,Retail,Ontario,Longos,Longo Brothers Fruit Market Inc.,Café latte biscotti
972,1363,Basha Foods International brand Baklava recalled due to undeclared peanut,2017-10-26,Peanut,Allergen,Class 1,Retail,Alberta,Basha Foods International,Basha International Foods Inc.,Baklava
973,1365,Various brands of vegetable products recalled due to Listeria monocytogenes,2017-10-22,Listeria monocytogenes,Microbiological,Class 1,Retail,Nationally,Various,"Buy Low Foods Ltd., Federated Co-operatives Ltd., Fresh Taste Produce Ltd., Freshpoint Vancouver Ltd., Hector Larivée Inc., Loblaw Companies Limited, Metro Ontario Inc., Overwaitea Food Group LP, Sobeys Inc., SYSCO Edmonton, SYSCO Halifax, SYSCO Moncton, SYSCO Mount Pearl, SYSCO Woodstock, The Lid Company, The Produce Terminal, Thomas Fresh Inc., Tomato King 2010 Inc., Van-Whole Produce Ltd., Walmart Canada Corp., Metro Richelieu Inc.",Of vegetable products
974,1367,Captain's Choice brand Frozen Shrimp Shaomai recalled due to undeclared egg,2017-10-20,Egg,Allergen,Class 1,Consumer,"Alberta, British Columbia, Manitoba, Saskatchewan",Captain's Choice,Hen Long Oriental Gifts and Foods Co. Ltd.,Frozen shrimp shaomai
975,1368,Yummy Market brand fish products recalled due to potential presence of dangerous bacteria,2017-10-19,Dangerous bacteria,Microbiological,Class 1,Consumer,Ontario,Yummy Market,Yummy Market Inc.,Fish products
976,1370,IHOC brand Rainbow Trout Caviar recalled due to potential presence of dangerous bacteria,2017-10-19,Dangerous bacteria,Microbiological,Class 1,Consumer,"Alberta, British Columbia, Manitoba, Ontario, Saskatchewan",IHOC,International House of Caviar,Rainbow trout caviar
977,1372,Well Preserved brand jams and jellies recalled due to broken seals,2017-10-17,Broken seals,Other,Class 3,Retail,Ontario,Well Preserved,"Community Living Grimsby, Lincoln and West Lincoln",Jams and jellies
978,1373,Mechanically Tenderized Steak recalled due to E. coli O157:H7,2017-10-17,E. coli o157:h7,Microbiological,Class 1,Retail,Retail,,Ontario,To e. coli o157:h7
979,1374,Janes brand frozen uncooked breaded chicken products recalled due to Salmonella,2017-10-17,Salmonella,Microbiological,Class 1,Retail,Nationally,Janes,Sofina Foods Inc.,Frozen uncooked breaded chicken products
980,1375,Certain Pacific Oysters recalled due to a marine biotoxin which causes Paralytic Shellfish Poisoning (PSP),2017-10-16,Marine Biotoxin,Marine Biotoxin,Class 1,Retail,"British Columbia, Quebec",,"Albion Fisheries Ltd. (Richmond), Union Bay Seafood Ltd.",Pacific oysters
981,1376,Yummy Market brand Smoked Lake Trout w/Pepper with Cracked Black Pepper recalled due to potential presence of dangerous bacteria,2017-10-14,Dangerous bacteria,Microbiological,Class 1,Retail,Retail,Yummy Market,Yummy Market Inc.,Smoked lake trout w/pepper with cracked black pepper
982,1377,Pacific brand Roasted Red Pepper and Tomato Soup recalled due to potential presence of dangerous bacteria,2017-10-13,Dangerous bacteria,Microbiological,Class 3,Retail,British Columbia,Pacific,Horizon Distributors Ltd.,Roasted red pepper and tomato soup
983,1378,Sultan of Samosas brand Samosas recalled due to pieces of metal,2017-10-12,Metal,Extraneous Material,Class 3,Retail,Ontario,Sultan of Samosas,Sultan of Samosas Inc.,Samosas
984,1379,Dynawhey brand and Maximus brand Whey Protein recalled due to undeclared milk,2017-10-11,Milk,Allergen,Class 3,Retail,Nationally,Dynawhey,Direct Nutrisciences Inc.,And maximus brand whey protein
985,1381,Chagnon brand Cultured Butter de la Haute-Yamaska recalled due to generic E. coli,2017-10-03,E. coli,Microbiological,Class 2,"Hotel/Restaurant/Institutional, Retail",Quebec,Chagnon,Laiterie Chagnon Ltee.,Cultured butter de la haute-yamaska
986,1382,Wolfgang Puck brand Creamy Butternut Squash Organic Soup recalled due to undeclared mustard,2017-10-02,Mustard,Allergen,Class 1,Retail,Nationally,Wolfgang Puck,Campbell Soup Company,Creamy butternut squash organic soup
