,index,title,date,hazard,hazard_type,recall_class,audience,distribution,brand,company,product
1776,2260,Uncle Bob's brand popcorn products recalled due to undeclared milk,2015-07-21,Milk,Allergen,Class 3,Retail,Ontario,Uncle Bob's,Ontario Popping Corn Co.,Popcorn products
1777,2261,The Healthy Butcher brand smoked fish voluntarily recalled due to potential presence of dangerous bacteria,2015-07-19,Dangerous bacteria,Microbiological,Class 1,Retail,Ontario,The Healthy Butcher,The Healthy Butcher,Smoked fish voluntarily
1778,2262,The Healthy Butcher brand smoked fish may be unsafe due to potential presence of dangerous bacteria,2015-07-18,Dangerous bacteria,Microbiological,Class 1,Retail,Ontario,The Healthy Butcher,,Smoked fish
1779,2263,Barber Foods brand uncooked stuffed chicken recalled due to Salmonella,2015-07-17,Salmonella,Microbiological,Class 1,Retail,Nationally,Barber Foods,Northbud Distributors Ltd.,Uncooked stuffed chicken
1780,2264,Wild Garden brand hummus products recalled due to undeclared sesame seeds,2015-07-17,Sesame,Allergen,Class 2,Retail,Nationally,Wild Garden,Tree of Life Canada,Hummus products
1781,2267,"Gloria's, Oven Pride Kitchen, Quality Fast Foods brands and Lunch Box sandwich products recalled due to Listeria monocytogenes",2015-07-16,Listeria monocytogenes,Microbiological,Class 1,Retail,Nationally,"Gloria's, Oven Pride Kitchen, Quality Fast Foods",HQ Fine Foods,And lunch box sandwich products
1782,2265,Salish Sea Foods LP brand farmed oysters recalled due to Vibrio parahaemolyticus,2015-07-16,Vibrio parahaemolyticus,Microbiological,Class 2,"Retail, Hotel/Restaurant/Institutional","Alberta, British Columbia, Saskatchewan",Salish Sea Foods LP,Salish Sea Foods LP,Farmed oysters
1783,2266,"Biscuits recalled due to undeclared egg, milk, and wheat",2015-07-16,"Egg, milk, , wheat",Allergen,Class 1,Retail,"Alberta, British Columbia, Manitoba, Nova Scotia, Ontario, Quebec, Saskatchewan",,KNV Food Corporation,"To undeclared egg, milk, and wheat"
1784,2269,Barber Foods brand uncooked stuffed chicken products recalled due to Salmonella,2015-07-14,Salmonella,Microbiological,Class 1,Retail,Nationally,Barber Foods,"Costco Wholesale Canada Inc., Northbud Distributors Ltd.",Uncooked stuffed chicken products
1785,2268,"Circle K brand products recalled due to undeclared egg, fish, milk and soy",2015-07-14,"Egg, fish, milk , soy",Allergen,Class 3,Retail,"New Brunswick, Newfoundland and Labrador, Nova Scotia",Circle K,Couche-Tard Inc.,Products
1786,2272,No Name and Barber Foods brands uncooked stuffed chicken products recalled due to Salmonella,2015-07-13,Salmonella,Microbiological,Class 1,Retail,Nationally,No Name and Barber Foods,"Costco Wholesale Canada Inc., Northbud Distributors Ltd.",Uncooked stuffed chicken products
1787,2271,Nutri-Qual brand BBQ Meats Party (Combo) Pack with Probiotic recalled due to undeclared wheat,2015-07-13,Wheat,Allergen,Class 3,Retail,"Prince Edward Island, Nova Scotia, Ontario, Quebec",Nutri-Qual,Giant Tiger Wholesale Ltd.,Bbq meats party (combo) pack with probiotic
1788,2274,H and A brand Natural Bar - Almond Bar recalled due to undeclared sesame seeds,2015-07-07,Sesame,Allergen,Class 3,Retail,Ontario,H and A,H&A Natural Bar Inc.,Natural bar - almond bar
1789,2275,Lollipop Candy recalled due to undeclared milk,2015-07-06,Milk,Allergen,Class 3,Retail,Ontario,,AJ International Trading (2372761 Ontario Inc.),To undeclared milk
1790,2277,"Circle K brand products recalled due to undeclared milk, mustard, soy and wheat",2015-07-04,"Milk, mustard, soy , wheat",Allergen,Class 2,Retail,"New Brunswick, Nova Scotia, Newfoundland and Labrador",Circle K,Couche-Tard Inc.,Products
1791,2276,Gloria's brand and Lunch Box Roast beef sandwich products recalled due to Listeria monocytogenes,2015-07-04,Listeria monocytogenes,Microbiological,Class 1,"Retail, Warehouse","Alberta, British Columbia, Ontario, Saskatchewan",Gloria's,HQ Fine Foods,And lunch box roast beef sandwich products
1792,2281,Hempola brand hemp powder recalled due to undeclared gluten,2015-07-03,Gluten,Allergen,Class 2,Retail,"Alberta, Prince Edward Island, Manitoba, New Brunswick, Ontario, Quebec, Newfoundland and Labrador",Hempola,Hempola Valley Farms,Hemp powder
1793,2280,Boulangerie Boutin brand surprise cookies recalled due to undeclared milk,2015-07-03,Milk,Allergen,Class 3,Retail,Quebec,Boulangerie Boutin,Boulangerie Boutin - Coopérative de travailleurs,Surprise cookies
1794,2279,Grimm's Fine Foods brand Home Style Roast Beef recalled due to Listeria monocytogenes,2015-07-03,Listeria monocytogenes,Microbiological,Class 1,Retail,Nationally,Grimm's Fine Foods,FG Deli Group Ltd.,Home style roast beef
1795,2278,Fanny Bay Oysters brand oysters recalled due to Vibrio parahaemolyticus,2015-07-03,Vibrio parahaemolyticus,Microbiological,Class 2,"Retail, Hotel/Restaurant/Institutional","British Columbia, Ontario",Fanny Bay Oysters,Taylor Shellfish Canada ULC dba Fanny Bay Oysters Ltd.,Oysters
1796,2282,no name and Compliments brands frozen uncooked breaded chicken products recalled due to Salmonella,2015-07-01,Salmonella,Microbiological,Class 1,Retail,Nationally,no name and Compliments,Sofina Foods Inc.,Frozen uncooked breaded chicken products
1797,2285,Going Nuts brand products recalled due to undeclared sulphites,2015-06-30,Sulphites,Allergen,Class 3,Retail,Alberta,Going Nuts,Going Nuts Inc.,Products
1798,2284,Tastee Choice brand Shrimp Sorrentino and Shrimp Fried Rice recalled due to undeclared milk and gluten,2015-06-30,"Milk , gluten",Allergen,Class 1,Retail,Nationally,Tastee Choice,Choice Canning Company Inc.,Shrimp sorrentino and shrimp fried rice
1799,2283,Delmare Quality Foods Inc. brand products recalled due to undeclared mustard,2015-06-30,Mustard,Allergen,Class 2,Hotel/Restaurant/Institutional,Ontario,Delmare Quality Foods Inc.,Delmare Quality Foods Inc.,Products
1800,2286,Polish dried sausage sold at Old Fashioned Meat & Deli Ltd. recalled due to Listeria monocytogenes,2015-06-29,Listeria monocytogenes,Microbiological,Class 1,Retail,Alberta,,Old Fashioned Meat & Deli Ltd.,To listeria monocytogenes
1801,2288,Loblaws (store-made) brand Spaghetti Sauce recalled due to pieces of glass,2015-06-26,Glass,Extraneous Material,Class 2,Retail,Quebec,Loblaws (store-made),Loblaw Companies Limited,Spaghetti sauce
1802,2289,Sunripe brand Caesar dressing products recalled due to undeclared mustard,2015-06-26,Mustard,Allergen,Class 2,Retail,Ontario,Sunripe,Sunripe Farms Produce (509334 Ontario Inc.),Caesar dressing products
1803,2290,Girard's brand Classic Chunky Bleu Cheese Dressing recalled due to undeclared mustard,2015-06-26,Mustard,Allergen,Class 1,Hotel/Restaurant/Institutional,Quebec,Girard's,GFS - Montreal,Classic chunky bleu cheese dressing
1804,2291,Winkler's Farmer Sausage Crumble - Naturally Smoked recalled due to Listeria monocytogenes,2015-06-24,Listeria monocytogenes,Microbiological,Class 1,Hotel/Restaurant/Institutional,Manitoba,,Winkler Meats Ltd.,To listeria monocytogenes
1805,2292,"La Cigogne brand ""Munster Géromé"" cheese recalled due to a toxin produced by Staphylococcus bacteria",2015-06-23,Staphylococcus aureus,Microbiological,Class 2,Retail,Nationally,La Cigogne,Les Dépendances,"""munster géromé"" cheese"
1806,2293,Swanson brand Stuffing Baked Turkey recalled due to undeclared monosodium glutamate,2015-06-23,Monosodium glutamate,Labelling,Class 3,Retail,"Alberta, British Columbia, Manitoba, New Brunswick, Nova Scotia, Ontario, Quebec, Saskatchewan, Newfoundland and Labrador",Swanson,Pinnacle Foods Canada Corporation,Stuffing baked turkey
1807,2294,Mixtura Latina Co. brand Mote Blanco Pelado / Peeled White Hominy recalled due to undeclared sulphites,2015-06-22,Sulphites,Allergen,Class 1,Retail,Ontario,Mixtura Latina Co.,Mixtura Latina Co.,Mote blanco pelado / peeled white hominy
1808,2295,Gay Lea brand 1% Chocolate Milk recalled due to high aerobic colony count,2015-06-22,High aerobic colony count,Microbiological,Class 3,Retail,Ontario,Gay Lea,Gay Lea Foods Co-Operative Limited,1% chocolate milk
1809,2296,Phoebe brand Mote Blanco / White Corn products recalled due to undeclared sulphites,2015-06-19,Sulphites,Allergen,Class 1,Retail,"Alberta, Manitoba, Ontario, Quebec, Saskatchewan",Phoebe,Aliments Candesa Foods,Mote blanco / white corn products
1810,2297,"Girard's brand mayonnaise, dressings and tartar sauce recalled due to undeclared mustard",2015-06-19,Mustard,Allergen,Class 1,Hotel/Restaurant/Institutional,"Alberta, Manitoba, Nova Scotia, Ontario",Girard's,JL International,"Mayonnaise, dressings and tartar sauce"
1811,2298,Papillon brand Roquefort cheese recalled due to a toxin produced by Staphylococcus bacteria,2015-06-19,Staphylococcus aureus,Microbiological,Class 2,Retail,Nationally,Papillon,Saputo Inc.,Roquefort cheese
1812,2299,Santan brand coconut milk powder and instant coconut cream powder recalled due to undeclared milk,2015-06-18,Milk,Allergen,Class 1,Retail,Nationally,Santan,HG Holdings (International) Corp,Coconut milk powder and instant coconut cream powder
1813,2302,"Hempola brand ""100% Hemp Powder, Protein & Fibre Powder"" recalled due to undeclared gluten",2015-06-16,Gluten,Allergen,Class 2,Retail,"British Columbia, New Brunswick, Nova Scotia, Ontario",Hempola,Hempola Valley Farms,"""100% hemp powder, protein & fibre powder"""
1814,2303,Champ's Mushrooms and President's Choice brand sliced mushroom products recalled due to Listeria monocytogenes,2015-06-16,Listeria monocytogenes,Microbiological,Class 1,Retail,Nationally,Champ's Mushrooms and President's Choice,Champ's Mushrooms,Sliced mushroom products
1815,2304,"Processed by Pacific Northwest Shellfish brand ""Fresh Pacific Oyster Miyagi, Farm Raised"" recalled due to Vibrio parahaemolyticus",2015-06-12,Vibrio parahaemolyticus,Microbiological,Class 2,Warehouse,"Alberta, British Columbia, Saskatchewan",Processed by Pacific Northwest Shellfish,Pacific Northwest Shellfish Co.  Ltd.,"""fresh pacific oyster miyagi, farm raised"""
1816,2305,Atkins & Frères brand Cold Smoked Salmon recalled due to nutrition labelling,2015-06-11,Labelling,Labelling,Class 3,Warehouse,Quebec,Atkins & Frères,Atkins & Frères Inc.,Cold smoked salmon
1817,2307,Wong's brand Wangjiadu Dry Pan or Spicy Condiment recalled due to undeclared peanuts,2015-06-10,Peanuts,Allergen,Class 3,Retail,Ontario,Wong's,Kam Wah Resources Co. Ltd.,Wangjiadu dry pan or spicy condiment
1818,2308,Roxy brand Unsweetened Coconut Cream Powder recalled due to undeclared milk,2015-06-10,Milk,Allergen,Class 1,Retail,Ontario,Roxy,Can Roxy Trading Inc.,Unsweetened coconut cream powder
1819,2309,Live Organic Raw brand Garden Vegetable Crackers recalled due to undeclared soy,2015-06-09,Soy,Allergen,Class 2,Retail,Ontario,Live Organic Raw,Live Organic Food Products Ltd.,Garden vegetable crackers
1820,2310,Champ's Mushrooms brand Sliced Mini Bella Mushrooms recalled due to Listeria monocytogenes,2015-06-07,Listeria monocytogenes,Microbiological,Class 1,Retail,Nationally,Champ's Mushrooms,Champ's Mushrooms,Sliced mini bella mushrooms
1821,2311,Information for consumers on Maggi brand noodle products from India,2015-06-05,,Chemical,--,Retail,Retail,Information for consumers on Maggi,--,Information for consumers on maggi
1822,2312,Juliang brand Goji Berry recalled due to undeclared sulphites,2015-06-04,Sulphites,Allergen,Class 2,Retail,Ontario,Juliang,Juliang Healthy Food Ltd.,Goji berry
1823,2313,Kirkland Signature brand Peanut Butter recalled due to pieces of plastic,2015-06-03,Plastic,Extraneous Material,Class 2,Retail,Ontario,Kirkland Signature,Costco #159 (Ajax),Peanut butter
1824,2314,CFIA advises consumers to use caution with infant formula products due to potential product substitution and/or tampering,2015-06-02,Tampering,Tampering,--,Retail,Retail,,National,To potential product substitution and/or tampering
1825,2321,Iron Cross Blister Beetles in Imported Pre-packaged Leafy Vegetables,2015-05-29,Iron cross blister beetles,Other,--,Retail,Nationally,,Retail,Imported pre-packaged leafy vegetables
1826,2319,Strub's brand Pickled Diced Sweet Pimentos recalled due to pesticide residues,2015-05-29,Pesticide residues,Chemical,Class 3,Hotel/Restaurant/Institutional,Nationally,Strub's,Whyte's,Pickled diced sweet pimentos
1827,2320,Cadbury Dairy Milk Brand Coconut Cashew chocolate product and related Cadbury Family Variety Packs recalled due to errors in nutritional labelling,2015-05-29,"Cadbury dairy milk br, coconut cashew chocolate product , related cadbury family variety packs recalled due to errors",Labelling,Class 3,Retail,Nationally,,Mondelez Canada Inc.,Coconut cashew chocolate product and related cadbury family variety packs
1828,2316,Bay Enterprises Ltd. brand American Oysters recalled due to generic E. coli,2015-05-29,E. coli,Microbiological,Class 2,"Retail, Hotel/Restaurant/Institutional",Nova Scotia,Bay Enterprises Ltd.,Bay Enterprises Limited,American oysters
1829,2318,Schneider's brand All Beef Bologna recalled due to undeclared milk and wheat,2015-05-29,"Milk , wheat",Allergen,Class 2,Retail,"Alberta, British Columbia, Manitoba, Nova Scotia, Ontario, Quebec, Saskatchewan",Schneider's,Maple Leaf Foods,All beef bologna
1830,2317,Willow Creek brand Certified Organic Curry Powder recalled due to undeclared mustard,2015-05-29,Mustard,Allergen,Class 2,Retail,"Alberta, British Columbia, Manitoba, Ontario, Saskatchewan, Northwest Territories",Willow Creek,Willow Creek Organic Grain Company Inc.,Certified organic curry powder
1831,2315,Sobeys brand Lean Ground Beef recalled due to pieces of wood,2015-05-29,Wood,Extraneous Material,Class 3,Retail,Nova Scotia,Sobeys,"Sobeys store #594 (Truro, NS)",Lean ground beef
1832,2322,President's Choice brand hummus and dip products recalled due to a toxin produced by Staphylococcus bacteria,2015-05-28,Staphylococcus aureus,Microbiological,Class 2,Retail,Nationally,President's Choice,Loblaw Companies Limited,Hummus and dip products
1833,2323,Maple Leaf Spices brand Curious Curry Refill recalled due to undeclared mustard,2015-05-27,Mustard,Allergen,Class 2,Retail,British Columbia,Maple Leaf Spices,Maple Leaf Spices,Curious curry refill
1834,2324,Vinh Thuan brand Instant Coconut Powder recalled due to undeclared milk,2015-05-27,Milk,Allergen,Class 2,Retail,"Ontario, Quebec",Vinh Thuan,1602797 Ontario Inc.,Instant coconut powder
1835,2325,Maple Leaf Spices brand spice products recalled due to undeclared mustard and sulphites,2015-05-25,"Mustard , sulphites",Allergen,Class 2,Retail,"Alberta, British Columbia",Maple Leaf Spices,Maple Leaf Spices,Spice products
1836,2326,President's Choice brand Moroccan-Style Hummus recalled due to a toxin produced by Staphylococcus bacteria,2015-05-25,Staphylococcus aureus,Microbiological,Class 2,Retail,Nationally,President's Choice,Loblaw Companies Limited,Moroccan-style hummus
1837,2327,Farmer's Market brand and Strang's Produce brand Russet Potatoes recalled due to possible tampering,2015-05-22,Tampering,Tampering,Class 3,Retail,"Prince Edward Island, New Brunswick, Nova Scotia, Newfoundland and Labrador",Farmer's Market,"Loblaw Companies Limited, Strang's Produce Inc.",And strang's produce brand russet potatoes
1838,2329,Compliments brand Beef Sausages recalled due to undeclared mustard and wheat,2015-05-21,"Mustard , wheat",Allergen,Class 2,Retail,"Alberta, British Columbia, Manitoba, Ontario, Saskatchewan",Compliments,Vantage Foods Inc.,Beef sausages
1839,2328,Suspected Food Tampering in Potatoes,2015-05-21,Tampering,Tampering,--,Retail,"Prince Edward Island, New Brunswick, Nova Scotia, Newfoundland and Labrador",,--,Potatoes
1840,2331,Quality Super Tasty brand Rajgira Laddu - Puffed Amaranth Dumplings recalled due to extraneous material,2015-05-20,Extraneous material,Extraneous Material,Class 3,Hotel/Restaurant/Institutional,Nationally,Quality Super Tasty,Quality Natural Foods Canada Inc.,Rajgira laddu - puffed amaranth dumplings
1841,2330,Glico Double Pretz and Glico Pretz brand Biscuit Sticks recalled due to undeclared milk,2015-05-20,Milk,Allergen,Class 2,Retail,Ontario,Glico Double Pretz and Glico Pretz,Kam Wah Resources Co. Ltd.,Biscuit sticks
1842,2332,Strux brand Build & Bite recalled due to presence of lead,2015-05-20,Lead,Chemical,Class 3,Retail,Nationally,Strux,Exclusive Candy & Novelty Distribution Ltd.,Build & bite
1843,2333,Pepper products recalled by Altius Spices and Seasonings Inc. due to presence of sand,2015-05-19,"S,",Extraneous Material,Class 3,Retail,Nationally,,Altius Spices and Seasonings Inc.,To presence of sand
1844,2334,Vasco Da Gama brand canned seafood products recalled due to potential presence of dangerous bacteria,2015-05-19,Dangerous bacteria,Microbiological,Class 2,Retail,Nationally,Vasco Da Gama,Tavora Holding Co. Ltd.,Canned seafood products
1845,2335,Brown Betty brand Coconut Milk Powder Mix recalled due to undeclared milk,2015-05-15,Milk,Allergen,Class 1,Retail,Nationally,Brown Betty,Bedesee Import Ltd.,Coconut milk powder mix
1846,2336,"Orion Ball recalled due to undeclared squid, crab, and shrimp",2015-05-15,"Squid, crab, , shrimp",Allergen,Class 1,Retail,Nationally,,Seoul Trading Corp.,"To undeclared squid, crab, and shrimp"
1847,2338,DXN brand instant coffee products recalled due to undeclared milk,2015-05-14,Milk,Allergen,Class 1,Retail,"Alberta, British Columbia, Manitoba, Ontario, Quebec, Saskatchewan",DXN,Daehsan Canada Inc.,Instant coffee products
1848,2339,The Soup Boy brand Carrot Soup recalled due to potential presence of dangerous bacteria,2015-05-13,Dangerous bacteria,Microbiological,Class 1,Retail,New Brunswick,The Soup Boy,The Soup Boy,Carrot soup
1849,2340,"Killarney Market brand ground beef, pork and turkey recalled due to E. coli O157:H7",2015-05-11,E. coli o157:h7,Microbiological,Class 1,Retail,Retail,Killarney Market,British Columbia,"Ground beef, pork and turkey"
1850,2341,Killarney Market brand ground beef recalled due to E. coli O157:H7,2015-05-09,E. coli o157:h7,Microbiological,Class 1,Retail,Retail,Killarney Market,British Columbia,Ground beef
1851,2343,Raw Milk St. Jorge Cheese recalled by Portuguese Cheese Company Limited due to Staphylococcus aureus,2015-05-07,Staphylococcus aureus,Microbiological,Class 2,Retail,Ontario,,Portuguese Cheese Company Limited,To staphylococcus aureus
1852,2344,Unico and Primo brand Red Kidney Beans recalled due to container integrity issues,2015-05-07,Container integrity issues,Microbiological,Class 2,Retail,Nationally,Unico and Primo,Unico Inc.,Red kidney beans
1853,2347,Clic brand Eston Green Lentils recalled due to extraneous material,2015-05-05,Extraneous material,Extraneous Material,Class 3,Retail,Nationally,Clic,AGT Clic,Eston green lentils
1854,2348,"Boulangerie Lemieux brand ""Moisson Santé Multigrain"" recalled due to nutrition labelling",2015-05-05,Labelling,Labelling,Class 3,Retail,Quebec,Boulangerie Lemieux,Boulangerie Lemieux,"""moisson santé multigrain"""
1855,2345,Provitus brand vegetable products and Olza Prince Polo brand wafers recalled due to undeclared allergens,2015-05-05,Allergens,Allergen,Class 3,Retail,Ontario,Provitus,Polish Trade Centre,Vegetable products and olza prince polo brand wafers
1856,2349,Certain Ezaki Glico brand Pretz recalled due to undeclared milk,2015-05-01,Milk,Allergen,Class 1,Retail,Nationally,Certain Ezaki Glico,"Henry Trading Co., Top Choice Import and Services",Pretz
1857,2350,Simple Simon Soups brand Lobster Chowder recalled due to undeclared egg,2015-05-01,Egg,Allergen,Class 1,Retail,Nationally,Simple Simon Soups,Simple Simon Pies,Lobster chowder
1858,2351,Lasco brand Coconut Cream Powder recalled due to undeclared milk,2015-05-01,Milk,Allergen,Class 2,Retail,"Alberta, Manitoba, Ontario",Lasco,Afribbean Foods,Coconut cream powder
1859,2352,Rescindment of Food Recall Warnings (Allergen)Cumin and Cumin-containing products recalled due to undeclared almond,2015-04-30,Almond,Allergen,--,Retail,Nationally,,Nador Inc.,To undeclared almond
1860,2353,Sliced apples and products containing sliced apples recalled due to Listeria monocytogenes,2015-04-30,Listeria monocytogenes,Microbiological,Class 1,Retail,Nationally,,Sun Rich Fresh Foods Inc.,To listeria monocytogenes
1861,2354,Simple Simon Meals brand Lobster Mac-n-Cheese recalled due to undeclared egg,2015-04-29,Egg,Allergen,Class 1,Retail,Nationally,Simple Simon Meals,Simple Simon Pies,Lobster mac-n-cheese
1862,2356,Smith Snacks brand Pizza Subs recalled due to undeclared fish,2015-04-27,Fish,Allergen,Class 3,Retail,Newfoundland and Labrador,Smith Snacks,Smith Snacks Service,Pizza subs
1863,2357,Heinz brand Sweet Potato and Beef Medley infant food recalled due to potential for spoilage,2015-04-25,Quality/Spoilage,Microbiological,Class 2,Retail,Nationally,Heinz,Heinz Canada,Sweet potato and beef medley infant food
1864,2358,Lazar Gourmet Foods brand Beef Samosas recalled due to undeclared mustard,2015-04-24,Mustard,Allergen,Class 3,Retail,Ontario,Lazar Gourmet Foods,Lazar Gourmet Foods,Beef samosas
1865,2359,Pinty's Eatwell brand chicken products recalled due to presence of pieces of rubber,2015-04-20,Rubber,Extraneous Material,Class 3,Retail,Nationally,Pinty's Eatwell,Pinty's Delicious Foods  Inc.,Chicken products
1866,2360,Nature Valley brand Sweet & Salty Dark Chocolate Nut Bars recalled due to pieces of wood,2015-04-17,Wood,Extraneous Material,Class 3,Retail,"Alberta, British Columbia, Manitoba, New Brunswick, Ontario, Quebec",Nature Valley,General Mills Canada Corporation,Sweet & salty dark chocolate nut bars
1867,2361,Gourmet Chef brand Creamy Coleslaw with Greek Yogurt recalled due to undeclared sunflower seeds,2015-04-17,Sunflower,Allergen,Class 3,Retail,"Alberta, British Columbia, Manitoba, Saskatchewan",Gourmet Chef,FGC Foods Ltd.,Creamy coleslaw with greek yogurt
1868,2362,Earth's Choice brand Organic Virgin Coconut Oil recalled due to mould,2015-04-16,Mould,Microbiological,Class 3,Retail,Nationally,Earth's Choice,Canadian Choice Wholesalers Ltd.,Organic virgin coconut oil
1869,2363,Market Town brand Cabbage Rolls recalled due to undercooking,2015-04-16,Undercooking,Microbiological,Class 3,Retail,"Alberta, British Columbia, Manitoba, Saskatchewan, Northwest Territories",Market Town,El Molino Foods of Canada (1972) Ltd.,Cabbage rolls
1870,2364,Rashad brand Baklawa Mix recalled due to undeclared cashews,2015-04-15,Cashews,Allergen,Class 2,Retail,Nationally,Rashad,Greenworld Food Express Inc.,Baklawa mix
1871,2365,Heinz brand Chicken with Broth infant food recalled due to potential for spoilage,2015-04-15,Quality/Spoilage,Microbiological,Class 2,Retail,Nationally,Heinz,Heinz Canada,Chicken with broth infant food
1872,2366,Whole Foods Market brand La Guadalupana Tamale Salsa Verde recalled due to undeclared egg,2015-04-14,Egg,Allergen,Class 2,Retail,Ontario,Whole Foods Market,"Whole Foods Market (Lansdowne Park), Whole Foods Market (Square One Drive), Whole Foods Market (Yonge/Sheppard)",La guadalupana tamale salsa verde
1873,2367,Pickled products recalled by Cibona Foods Inc. due to spoilage,2015-04-10,Quality/Spoilage,Microbiological,Class 3,"Hotel/Restaurant/Institutional, Retail","Ontario, Quebec",,Cibona Foods Inc.,To spoilage
1874,2369,East Coast Beef Jerky brand Beef Jerky recalled due to undeclared allergens,2015-04-10,Allergens,Allergen,Class 3,Retail,New Brunswick,East Coast Beef Jerky,East Coast Beef Jerky,Beef jerky
1875,2370,Kirkland Signature brand roasted chicken salad containing fully cooked sliced chicken breast recalled due to Listeria monocytogenes,2015-04-03,Listeria monocytogenes,Microbiological,Class 1,Retail,"Alberta, British Columbia, Manitoba, New Brunswick, Newfoundland and Labrador, Nova Scotia, Ontario, Quebec, Saskatchewan",Kirkland Signature,Costco Wholesale Canada Inc.,Roasted chicken salad containing fully cooked sliced chicken breast
1876,2371,Various Sobeys in-store prepared salads containing fully cooked sliced chicken breast recalled due to Listeria monocytogenes,2015-04-03,Various sobeys,Microbiological,Class 1,Retail,"Alberta, British Columbia, Manitoba, Saskatchewan",,Sobeys Inc.,To listeria monocytogenes
1877,2372,Pinty's Pub & Grill brand Chicken Parmesan recalled due to pieces of plastic,2015-04-02,Plastic,Extraneous Material,Class 2,Retail,Nationally,Pinty's Pub & Grill,Pinty's Delicious Foods  Inc.,Chicken parmesan
1878,2373,Recall of Homestyle Meats brand sausages due to undeclared wheat,2015-04-01,Wheat,Allergen,Class 3,Retail,Saskatchewan,Recall of Homestyle Meats,Homestyle Meats,To undeclared wheat
1879,2374,Lilydale brand Oven Roasted Carved Chicken Breast and Oven Roasted Carved Turkey Breast recalled due to Listeria monocytogenes,2015-04-01,Listeria monocytogenes,Microbiological,Class 1,"Retail, Hotel/Restaurant/Institutional",Nationally,Lilydale,Lilydale,Oven roasted carved chicken breast and oven roasted carved turkey breast
1880,2375,Korean curry products recalled by Seoul Trading Corp. due to undeclared mustard,2015-04-01,Mustard,Allergen,Class 3,Retail,"Alberta, British Columbia, Manitoba, Saskatchewan",,Seoul Trading Corp.,To undeclared mustard
1881,2376,TT Co. brand Premium Flavoured Cream Powders recalled due to undeclared milk,2015-03-31,Milk,Allergen,Class 3,Retail,Hotel/Restaurant/Institutional,TT Co.,"Alberta, British Columbia",Premium flavoured cream powders
1882,2377,Farm Boy brand Coconut Curry Lentil Soup recalled due to pieces of plastic,2015-03-31,Plastic,Extraneous Material,Class 2,Retail,Ontario,Farm Boy,Farm Boy 2012 Inc.,Coconut curry lentil soup
1883,2378,Dalisa brand Pork Roast recalled due to undeclared sulphites,2015-03-31,Sulphites,Allergen,Class 3,Retail,Quebec,Dalisa,Multi-Portions Inc.,Pork roast
1884,2380,Organic garlic powder recalled due to Salmonella,2015-03-27,Salmonella,Microbiological,Class 2,Retail,Saskatchewan,,Steep Hill Food Co-op,To salmonella
