,index,title,date,hazard,hazard_type,recall_class,audience,distribution,brand,company,product
2778,3435,Undeclared egg in certain Chocolat Jean-Talon brand Hollow Milk Flavoured Confections,2013-05-14,Egg,Allergen,Class 1,Retail,Nationally,Undeclared egg in certain Chocolat Jean-Talon,Chocolat Jean-Talon Chocolate Inc.,Undeclared egg in certain chocolat jean-talon
2779,3436,Certain Ghana Fresh brand Palmnut Cream Concentrate may contain harmful bacteria,2013-05-11,Dangerous bacteria,Microbiological,Class 2,Retail,Nationally,Certain Ghana Fresh,Xpress Tropical Foods & Meat,Certain ghana fresh
2780,3437,Certain Hazelnuts In-Shell may contain Salmonella bacteria,2013-05-10,Salmonella,Microbiological,Class 2,"Retail, Warehouse","New Brunswick, Ontario, Quebec",,Délices de la Forêt Valli,Salmonella bacteria
2781,3438,"Certain almond butter, peanut butter and tahini sold in bulk or repackaged at various retailers may contain Salmonella or other harmful bacteria",2013-05-10,Salmonella,Microbiological,Class 2,Retail,"Alberta, British Columbia, New Brunswick, Nova Scotia, Ontario, Quebec, Saskatchewan",,Tootsi Impex Inc.,Salmonella or other harmful bacteria
2782,3439,Undeclared sulphites in certain Golden Sun brand Seedless Raisins,2013-05-10,Sulphites,Allergen,Class 1,Retail,"Quebec, Newfoundland and Labrador",Undeclared sulphites in certain Golden Sun,Mitchell Agencies/Concord National,Undeclared sulphites in certain golden sun
2783,3440,Bone fragments in certain Country Ribbon brand salami,2013-05-10,Bone,Extraneous Material,Class 3,"Retail, Hotel/Restaurant/Institutional",Newfoundland and Labrador,Bone fragments in certain Country Ribbon,Country Ribbon Inc.,Bone fragments in certain country ribbon
2784,3441,Bone fragments in certain St-Hubert brand pork back ribs,2013-05-10,Bone,Extraneous Material,Class 2,Retail,Nationally,Bone fragments in certain St-Hubert,"Maître Saladier, S.E.C.",Bone fragments in certain st-hubert
2785,3442,Metal in certain M & M Brand Stuffed Potato Shells,2013-05-10,Metal,Extraneous Material,Class 2,Retail,Nationally,,M & M Meat Shops Ltd.,Metal in certain m & m
2786,3443,Undeclared gluten in Big Life Whole Foods brand Gluten Free Crusts,2013-05-09,Gluten,Allergen,Class 3,"Retail, Hotel/Restaurant/Institutional",Nova Scotia,Undeclared gluten in Big Life Whole Foods,Big Life Whole Foods / Sowelu Inc.,Undeclared gluten in big life whole foods
2787,3444,Undeclared milk in New JHK Trading Co. Ltd. brand taro powder,2013-05-08,Milk,Allergen,Class 1,Hotel/Restaurant/Institutional,British Columbia,Undeclared milk in New JHK Trading Co. Ltd.,New JHK Trading Co. Ltd.,Undeclared milk in new jhk trading co. ltd.
2788,3446,Undeclared almonds in certain The Bakery Counter brand cake,2013-05-07,Almonds,Allergen,Class 2,Retail,"Alberta, British Columbia, Manitoba, Ontario, Saskatchewan",Undeclared almonds in certain The Bakery Counter,Canada Safeway Ltd.,Undeclared almonds in certain the bakery counter
2789,3445,Undeclared sesame in Skinny B brand Dragons' blend breakfast cereal,2013-05-07,Sesame,Allergen,Class 3,Retail,Nationally,Undeclared sesame in Skinny B,Hapi Foods Group Inc.,Undeclared sesame in skinny b
2790,3448,Undeclared milk in certain Rococo Fine Foods brand nut products,2013-05-06,Milk,Allergen,Class 3,Retail,Nationally,Undeclared milk in certain Rococo Fine Foods,Rococo Fine Foods Inc.,Undeclared milk in certain rococo fine foods
2791,3449,Undeclared milk in certain Hevy D's Old Fashioned Kettle Korn product,2013-05-06,Milk,Allergen,Class 1,Retail,"Alberta, British Columbia, Manitoba, Ontario, Saskatchewan",,Hevy D's Old Fashioned Kettle Korn,Hevy d's old fashioned kettle korn product
2792,3447,Undeclared milk in Kameda brand Rice Crackers,2013-05-06,Milk,Allergen,Class 2,Retail,British Columbia,Undeclared milk in Kameda,True World Foods Inc. of Canada,Undeclared milk in kameda
2793,3450,Undeclared mustard in certain frozen pizzas,2013-05-04,Mustard,Allergen,Class 1,Consumer,Nationally,,RFG Canada Inc.,Frozen pizzas
2794,3451,Certain Black River Juice brand Organic Sweet Apple Cider may contain patulin,2013-05-04,Patulin,Chemical,Class 2,Retail,"Ontario, Quebec",Certain Black River Juice,Black River Juice Co. Ltd.,Certain black river juice
2795,3454,"Improperly declared egg, shellfish, soy and wheat in various Ah Fong Food brand products",2013-05-03,"egg, shellfish, soy , wheat",Allergen,Class 3,Retail,Ontario,"Improperly declared egg, shellfish, soy and wheat in various Ah Fong Food",Ah Fong Food Products Ltd.,"Improperly declared egg, shellfish, soy and wheat in various ah fong food"
2796,3456,"Delissio brand Thin Crispy Crust Grilled Chicken, Tomato & Spinach pizza may contain pieces of plastic",2013-05-02,Plastic,Extraneous Material,Class 2,Retail,Nationally,Delissio,Nestle Canada Inc.,Delissio
2797,3458,Undeclared milk in Blue Dragon brand Wasabi Plum Stir-Fry Sauce,2013-05-01,Milk,Allergen,Class 1,Retail,Nationally,Undeclared milk in Blue Dragon,I-D Foods Corporation,Undeclared milk in blue dragon
2798,3460,Undeclared milk in certain Co-Op Gold brand Toffee Kettle Corn,2013-04-30,Milk,Allergen,Class 1,Retail,Nationally,Undeclared milk in certain Co-Op Gold,Hevy D's Old Fashioned Kettle Korn,Undeclared milk in certain co-op gold
2799,3459,Certain flours from Aliments Trigone Inc. are recalled,2013-04-30,,Other,Class 3,"Retail, Hotel/Restaurant/Institutional",Quebec,,Aliments Trigone Inc.,Flours from aliments trigone inc. are
2800,3462,Undeclared milk in certain Hevy D's Old Fashioned Kettle Korn and Co-Op Gold brand popcorn products,2013-04-29,Milk,Allergen,Class 1,Retail,"Alberta, British Columbia, Manitoba, Ontario, Saskatchewan",Undeclared milk in certain Hevy D's Old Fashioned Kettle Korn and Co-Op Gold,Hevy D's Old Fashioned Kettle Korn,Undeclared milk in certain hevy d's old fashioned kettle korn and co-op gold
2801,3463,Undeclared milk in Hevy D's Old Fashioned Kettle Korn brand Caramel Flavour Gourmet Popcorn,2013-04-26,Milk,Allergen,Class 1,Retail,"Alberta, British Columbia, Manitoba, Saskatchewan",Undeclared milk in Hevy D's Old Fashioned Kettle Korn,Hevy D's Old Fashioned Kettle Korn,Undeclared milk in hevy d's old fashioned kettle korn
2802,3464,Undeclared milk in certain Ja-Patty brand products,2013-04-26,Milk,Allergen,Class 2,Retail,Ontario,Undeclared milk in certain Ja-Patty,Ja-Patty,Undeclared milk in certain ja-patty
2803,3465,Undeclared mustard in certain Safeway brand curry powder,2013-04-26,Mustard,Allergen,Class 2,Retail,"Alberta, British Columbia, Manitoba, Ontario, Saskatchewan, Northwest Territories",Undeclared mustard in certain Safeway,Canada Safeway Ltd.,Undeclared mustard in certain safeway
2804,3466,Undeclared mustard in certain macaroni and potato salad products from Arbutus Ridge Farms Ltd.,2013-04-26,Mustard,Allergen,Class 1,"Retail, Hotel/Restaurant/Institutional",Nationally,,Arbutus Ridge Farms Ltd.,Macaroni and potato salad products from arbutus ridge farms ltd.
2805,3467,Improperly declared milk in certain Trung Nguyen G7 brand coffee products,2013-04-26,milk,Allergen,Class 3,Retail,Ontario,Improperly declared milk in certain Trung Nguyen G7,D. J. Distributing,Improperly declared milk in certain trung nguyen g7
2806,3468,"Certain Seasoned, Cooked Chicken Breast Strips prepared by Le Champ du Coq Inc., may contain Salmonella bacteria",2013-04-25,Salmonella,Microbiological,Class 2,Retail,Nationally,,Desco Services Alimentaires Inc.,Salmonella bacteria
2807,3470,"Certain Le Champ du Coq Inc. brand Seasoned, cooked chicken breast strips may contain Salmonella bacteria",2013-04-19,Salmonella,Microbiological,Class 2,Hotel/Restaurant/Institutional,Quebec,Certain Le Champ du Coq Inc.,Exceldor Avicole Cooperative,Certain le champ du coq inc.
2808,3472,Undeclared sesame seeds in various Ah Fong Food brand products,2013-04-18,Sesame,Allergen,Class 3,Retail,Ontario,Undeclared sesame seeds in various Ah Fong Food,Ah Fong Food Products Ltd.,Undeclared sesame seeds in various ah fong food
2809,3473,Undeclared mustard in Cedar Bay brand Shrimp Haddock Nest,2013-04-17,Mustard,Allergen,Class 1,Retail,"Prince Edward Island, New Brunswick, Nova Scotia, Newfoundland and Labrador",Undeclared mustard in Cedar Bay,Granville Gates & Sons Ltd.,Undeclared mustard in cedar bay
2810,3474,Certain smoked fish products sold at Hooked stores in Toronto may contain dangerous bacteria,2013-04-13,Dangerous bacteria,Microbiological,Class 1,Retail,Retail,,Hooked Inc.,Dangerous bacteria
2811,3475,Certain smoked fish sold at Hooked stores in Toronto may contain dangerous bacteria,2013-04-13,Dangerous bacteria,Microbiological,Class 1,Retail,Ontario,,Hooked Inc.,Dangerous bacteria
2812,3476,Certain St. Thomas brand Bottled Seafood Products may contain dangerous bacteria,2013-04-13,Dangerous bacteria,Microbiological,Class 1,Retail,Nationally,Certain St. Thomas,St-Thomas Fish Market Inc.,Certain st. thomas
2813,3477,Undeclared milk in certain Trung Nguyen G7 brand Coffee 3 in 1 products,2013-04-12,Milk,Allergen,Class 1,Retail,Nationally,Undeclared milk in certain Trung Nguyen G7,Canadian Certified Importer Ltd.,Undeclared milk in certain trung nguyen g7
2814,3479,Osmat Imports brand Stuffed Eggplants may contain dangerous bacteria,2013-04-10,Dangerous bacteria,Microbiological,Class 1,Retail,"Alberta, British Columbia",Osmat Imports,Osmat Imports,Osmat imports
2815,3480,Certain Trophy brand Nut Mix In Shell may contain Salmonella bacteria,2013-04-10,Salmonella,Microbiological,Class 2,Retail,Nationally,Certain Trophy,Trophy Foods Inc.,Certain trophy
2816,3478,Certain Bick's Pickled Bean Salad is recalled,2013-04-10,,Microbiological,Class 3,Hotel/Restaurant/Institutional,Nationally,,Smucker Foods Of Canada Co.,Bick's pickled bean salad is
2817,3481,Certain Great Value brand Ground Cinnamon Spice is recalled,2013-04-09,,Other,Class 3,Retail,Nationally,Certain Great Value,Walmart Canada Corp.,Ground cinnamon spice is
2818,3483,Certain St. Thomas brand Bottled Lobster may contain dangerous bacteria,2013-04-06,Dangerous bacteria,Microbiological,Class 1,Retail,Nationally,Certain St. Thomas,St-Thomas Fish Market Inc.,Certain st. thomas
2819,3484,Certain Central-Epicure brand Smoked Atlantic Salmon may contain Listeria monocytogenes,2013-04-05,Listeria monocytogenes,Microbiological,Class 1,Retail,Ontario,Certain Central-Epicure,Central-Epicure Food Products Ltd.,Certain central-epicure
2820,3485,Undeclared Shrimp in Aliments Prolimer Inc. brand Curry Beef with Rice and Gravy,2013-04-05,Shrimp,Allergen,Class 2,Retail and Hotel/Restaurant/Institutional,Quebec,Undeclared Shrimp in Aliments Prolimer Inc.,Aliments Prolimer Inc.,Undeclared shrimp in aliments prolimer inc.
2821,3486,Certain Trophy brand Hazelnuts In Shell may contain Salmonella bacteria,2013-04-04,Salmonella,Microbiological,Class 2,Retail,Nationally,Certain Trophy,Trophy Foods Inc.,Certain trophy
2822,3487,Undeclared milk in Coffeeking 3 In 1 Coffeemix from Singapore,2013-04-03,Milk,Allergen,Class 1,Retail,Nationally,,Wycen Foods (Canada) Inc.,Coffeeking 3 in 1 coffeemix from singapore
2823,3488,"Undeclared milk in certain Heartland Gourmet Gluten Free, Dairy Free, Baking Mixes",2013-04-03,Milk,Allergen,Class 1,Retail,Nationally,,Winners Merchants International LP,"Heartland gourmet gluten free, dairy free, baking mixes"
2824,3489,Certain Central-Epicure brand smoked salmon products may contain Listeria monocytogenes,2013-04-03,Listeria monocytogenes,Microbiological,Class 1,"Retail, Hotel/Restaurant/Institutional",Ontario,Certain Central-Epicure,Central-Epicure Food Products Ltd.,Certain central-epicure
2825,3490,Undeclared milk in Kugi Foods Blue Mountain Roasted Coffee from Taiwan,2013-04-02,Milk,Allergen,Class 1,Consumer,"Alberta, British Columbia",,Uncle T Food Ltd.,Kugi foods blue mountain roasted coffee from taiwan
2826,3491,"Certain Central-Epicure brand Gefilte Fish, Ready to Serve may contain Dangerous Bacteria",2013-03-29,Dangerous bacteria,Microbiological,Class 1,Retail,"Ontario, Quebec",Certain Central-Epicure,Central-Epicure Food Products Ltd.,Certain central-epicure
2827,3492,Undeclared mustard in Freybe brand Summer Sausage,2013-03-28,Mustard,Allergen,Class 3,Retail,"Alberta, British Columbia, Saskatchewan",Undeclared mustard in Freybe,Freybe Gourmet Foods Ltd.,Undeclared mustard in freybe
2828,3494,Undeclared milk in certain NuGO brand Products,2013-03-25,Milk,Allergen,Class 1,Retail,"Alberta, British Columbia, Prince Edward Island, Manitoba, Nova Scotia, Ontario, Quebec, Saskatchewan, Yukon",Undeclared milk in certain NuGO,Multiple - see Additional Details,Undeclared milk in certain nugo
2829,3495,Certain St. Thomas brand bar clams and bar clam stew may contain dangerous bacteria,2013-03-23,Dangerous bacteria,Microbiological,Class 1,Retail,"Prince Edward Island, New Brunswick, Quebec",Certain St. Thomas,St-Thomas Fish Market Inc.,Certain st. thomas
2830,3496,Undeclared milk in Chelsea Chocolates brand confectioneries,2013-03-23,Milk,Allergen,Class 2,Retail,Ontario,Undeclared milk in Chelsea Chocolates,Chelsea Chocolates,Undeclared milk in chelsea chocolates
2831,3497,"Certain nut butters, peanuts, sugar and tahini from Vicrossano Inc. may contain Salmonella or other harmful bacteria",2013-03-23,Salmonella,Microbiological,Class 2,Retail,Nationally,,"Les Soeurs en Vrac, Vicrossano Inc.",Salmonella or other harmful bacteria
2832,3498,Undeclared milk in certain G7 brand 3 In 1 Instant Coffee from Viet Nam,2013-03-22,Milk,Allergen,Class 1,Retail,Nationally,Undeclared milk in certain G7,,Undeclared milk in certain g7
2833,3500,Certain Nestle brand Kit Kat Chunky bars may contain pieces of plastic,2013-03-22,Plastic,Extraneous Material,Class 2,Retail,Nationally,Certain Nestle,Nestle Canada Inc.,Certain nestle
2834,3501,Undeclared mustard in M & M Meat Shops brand Gingered Beef,2013-03-22,Mustard,Allergen,Class 3,Retail,Nationally,Undeclared mustard in M & M Meat Shops,Mountain Top Foods Ltd.,Undeclared mustard in m & m meat shops
2835,3502,Undeclared milk in G7 brand instant coffee,2013-03-22,Milk,Allergen,Class 3,Retail,"Alberta, British Columbia",Undeclared milk in G7,Uncle T Food Ltd.,Undeclared milk in g7
2836,3503,Undeclared milk in Kameda brand rice crackers,2013-03-19,Milk,Allergen,Class 2,Retail,"British Columbia, Nova Scotia, Ontario, Quebec",Undeclared milk in Kameda,Nishimoto Trading Co. Ltd.,Undeclared milk in kameda
2837,3504,Certain St. Thomas brand bar clams may contain dangerous bacteria,2013-03-15,Dangerous bacteria,Microbiological,Class 1,Retail,"Prince Edward Island, New Brunswick, Quebec",Certain St. Thomas,St-Thomas Fish Market Inc.,Certain st. thomas
2838,3505,"Bulk in-shell walnuts from Produce Depot (Bank St., Ottawa) may contain Salmonella bacteria",2013-03-15,Salmonella,Microbiological,--,Consumer,Ontario,,Produce Depot,Salmonella bacteria
2839,3506,Undeclared yam and sweet potato in Grimm's Fine Foods brand agnolotti,2013-03-14,"Yam , sweet potato",Allergen,Class 3,Retail,Nationally,Undeclared yam and sweet potato in Grimm's Fine Foods,Grimm's Fine Foods,Undeclared yam and sweet potato in grimm's fine foods
2840,3507,Undeclared Milk and Wheat in Chelsea Chocolates brand Chocolate Products,2013-03-13,"Milk , wheat",Allergen,Class 2,Retail,Ontario,Undeclared Milk and Wheat in Chelsea Chocolates,Chelsea Chocolates,Undeclared milk and wheat in chelsea chocolates
2841,3509,Certain Formaggio brand Artisan Wraps Italian Style Meats around Fresh Mozzarella may contain Listeria monocytogenes,2013-03-12,Listeria monocytogenes,Microbiological,Class 1,Retail,"New Brunswick, Nova Scotia, Ontario, Quebec, Newfoundland and Labrador",Certain Formaggio,Costco Wholesale Canada Ltd.,Certain formaggio
2842,3511,Undeclared milk in certain Jak brand Instant Coffee 3 in 1,2013-03-12,Milk,Allergen,Class 1,Retail,"Alberta, British Columbia, Ontario",Undeclared milk in certain Jak,Uncle T Food Ltd.,Undeclared milk in certain jak
2843,3508,St-Thomas brand bar clams may contain Clostridium botulinum,2013-03-12,Clostridium botulinum,Microbiological,Class 1,Retail,New Brunswick,St-Thomas,St-Thomas Fish Market Inc.,St-thomas
2844,3512,Undeclared milk in certain Anita's Organic Mill products,2013-03-08,Milk,Allergen,Class 1,"Retail, Hotel/Restaurant/Institutional",Nationally,,Anita's Organic Grain & Flour Mill Ltd.,Anita's organic mill products
2845,3513,"Undeclared milk in certain Heartland Gourmet Gluten Free, Dairy Free, Double Chocolate Cookie Mix",2013-03-07,Milk,Allergen,Class 1,Retail,Nationally,,Norcard Fundraising Canada,"Heartland gourmet gluten free, dairy free, double chocolate cookie mix"
2846,3514,Certain Selection brand Hashbrown Potatoes may contain extraneous material (non-harmful),2013-03-07,Extraneous material,Extraneous Material,Class 3,Retail,"Ontario, Quebec, Newfoundland and Labrador",Certain Selection,Metro Ontario Inc.,Certain selection
2847,3515,Undeclared milk in certain NuGO brand Bars,2013-03-07,Milk,Allergen,Class 1,Retail,"Alberta, British Columbia, Prince Edward Island, Manitoba, New Brunswick, Nova Scotia, Ontario, Quebec, Saskatchewan, Newfoundland and Labrador, Northwest Territories, Yukon",Undeclared milk in certain NuGO,Multiple - see Additional Details,Undeclared milk in certain nugo
2848,3516,Undeclared mustard in Sakellis Foods brand Pickling Spice,2013-03-07,Mustard,Allergen,Class 3,Hotel/Restaurant/Institutional,Ontario,Undeclared mustard in Sakellis Foods,Sakellis Foods,Undeclared mustard in sakellis foods
2849,3517,Certain Merilin International Trading brand Curry Powder may contain Bacillus cereus bacteria,2013-03-06,Bacillus cereus,Microbiological,Class 2,Retail,Ontario,Certain Merilin International Trading,Merilin International Trading Inc.,Certain merilin international trading
2850,3518,Certain New Milano brand Pepperoni may contain Listeria and Salmonella,2013-03-06,Listeria monocytogenes,Microbiological,Class 1,Hotel/Restaurant/Institutional,"Ontario, Quebec",Certain New Milano,Produits Alimentaires Italiens Milano Inc.,Certain new milano
2851,3519,Metal in certain Hanwell Village Mart ground beef products,2013-03-06,Metal,Extraneous Material,Class 2,Retail,New Brunswick,,Hanwell Village Mart,Hanwell village mart ground beef products
2852,3521,Undeclared almond in Food for Life Ezekiel 4:9 Cereal,2013-03-04,Almond,Allergen,Class 1,Retail,Nationally,,"Ed Core Marketing Ltd., Integra Brand Management",Food for life ezekiel 4:9 cereal
2853,3520,Certain Proti Diet High Protein Chocolate Dream Bar may contain Salmonella bacteria,2013-03-04,Salmonella,Microbiological,Class 2,Retail,"Ontario, Quebec",,Pro-Amino International Inc.,Salmonella bacteria
2854,3522,Certain Mauri brand Gorgonzola may contain Listeria monocytogenes,2013-03-01,Listeria monocytogenes,Microbiological,Class 1,Retail,"Alberta, New Brunswick, Nova Scotia, Ontario, Quebec",Certain Mauri,Arla Foods Incorporated,Certain mauri
2855,3523,Certain Simply Food brand Blueberry Pomegranate Nut Clusters may contain glass,2013-03-01,Glass,Extraneous Material,Class 2,Retail,"Prince Edward Island, New Brunswick, Nova Scotia, Ontario, Quebec, Newfoundland and Labrador",Certain Simply Food,Shoppers Drug Mart,Certain simply food
2856,3524,"Undeclared egg in certain Sun Shun Fuk (Sau Tao) brand ""Noodle King (Thin) Lobster Soup Flavored""",2013-03-01,Egg,Allergen,Class 3,Retail,"New Brunswick, Nova Scotia, Ontario, Quebec",Undeclared egg in certain Sun Shun Fuk (Sau Tao),Fair Trading Co. Ltd.,Undeclared egg in certain sun shun fuk (sau tao)
2857,3526,"Undeclared sulphites in certain Preserved Lemon, Preserved Star Fruit and Preserved Mandarin",2013-02-27,Sulphites,Allergen,Class 3,Retail,Ontario,,Summer Star Trading Co. Ltd.,"Preserved lemon, preserved star fruit and preserved mandarin"
2858,3527,Certain New Milano brand Pepperoni may contain Listeria,2013-02-27,Listeria monocytogenes,Microbiological,Class 1,Hotel/Restaurant/Institutional,Quebec,Certain New Milano,Produits Alimentaires Italiens Milano Inc.,Certain new milano
2859,3528,Undeclared milk in Nu Go Free brand Trail Mix Bar,2013-02-27,Milk,Allergen,Class 1,Retail,"Alberta, British Columbia, Manitoba, Saskatchewan",Undeclared milk in Nu Go Free,London Drugs Limited,Undeclared milk in nu go free
2860,3532,Undeclared sulphites in certain Kettle brand products,2013-02-25,Sulphites,Allergen,Class 3,Retail,"Alberta, British Columbia",Undeclared sulphites in certain Kettle,Overwaitea Food Group,Undeclared sulphites in certain kettle
2861,3531,Undeclared sulphites in certain Kettle brand Honey Roast Nuts & Fruit Mix,2013-02-25,Sulphites,Allergen,Class 3,Retail,"Alberta, British Columbia, Manitoba",Undeclared sulphites in certain Kettle,Horizon Distributors Ltd.,Undeclared sulphites in certain kettle
2862,3530,Certain Clic brand Sesame Paste Tahina may contain Salmonella bacteria,2013-02-25,Salmonella,Microbiological,Class 2,Retail,Nationally,Certain Clic,Clic International Inc.,Certain clic
2863,3536,Certain tea products may contain Salmonella bacteria,2013-02-24,Salmonella,Microbiological,Class 2,Retail,"Alberta, British Columbia, Manitoba, Ontario",,Murchie's Tea and Coffee Ltd.,Salmonella bacteria
2864,3538,Certain TEGA brand ORGANIC LEMON HIBISCUS GREEN ROOIBOS HERBAL TEA may contain Salmonella bacteria,2013-02-23,Salmonella,Microbiological,Class 2,Retail,"Alberta, British Columbia, Manitoba, Ontario, Quebec, Saskatchewan",Certain TEGA,Nu-Tea Company Ltd.,Certain tega
2865,3539,Undeclared gluten in certain J1 brand Crunchy Rice Rolls,2013-02-22,Gluten,Allergen,Class 3,Retail,"Manitoba, New Brunswick, Nova Scotia, Ontario, Quebec",Undeclared gluten in certain J1,UNFI Canada Inc.,Undeclared gluten in certain j1
2866,3540,Undeclared milk in James Bun brand Pastry Sheets,2013-02-21,Milk,Allergen,Class 3,Retail and Hotel/Restaurant/Institutional,"Alberta, British Columbia",Undeclared milk in James Bun,Canada Volumes Import/Export Inc.,Undeclared milk in james bun
2867,3542,Undeclared sesame in Master Kong brand Spicy Beef Noodle,2013-02-20,Sesame,Allergen,Class 1,Retail,"Alberta, British Columbia, Ontario",Undeclared sesame in Master Kong,,Undeclared sesame in master kong
2868,3544,Certain Cardinal brand Beef Burgers may contain E. coli,2013-02-19,E. coli,Microbiological,Class 1,Retail,"Ontario, Quebec",Certain Cardinal,Cardinal Meat Specialists Limited,Certain cardinal
2869,3546,Certain The Gourmet Meat Shoppe and The Butcher's Cut brands of Frozen Beef Burgers may contain E. coli O157:H7 bacteria,2013-02-19,E. coli o157:h7,Microbiological,Class 1,Retail,"Alberta, British Columbia, Manitoba, Ontario, Saskatchewan, Northwest Territories",Certain The Gourmet Meat Shoppe and The Butcher's Cut,Canada Safeway Ltd.,Certain the gourmet meat shoppe and the butcher's cut
2870,3547,Voluntary Recall: PC White Corn Black Bean Mild Salsa and PC Salsa Mild,2013-02-19,,Other,Class 2,Retail,"Alberta, British Columbia, Prince Edward Island, Manitoba, New Brunswick, Nova Scotia, Ontario, Quebec, Saskatchewan, Newfoundland and Labrador",,Loblaw Companies Limited,
2871,3548,Undeclared peanut in Barr's brand Almond Bark,2013-02-18,Peanut,Allergen,Class 3,Retail,Saskatchewan,Undeclared peanut in Barr's,Sweet Revenge Confection Company,Undeclared peanut in barr's
2872,3549,Certain Gogo Quinoa brand Amaranth and Kaniwa Cream are recalled,2013-02-18,,Other,Class 3,Retail,"Ontario, Quebec",Certain Gogo Quinoa,Cie 2 Ameriks Inc.,Amaranth and kaniwa cream are
2873,3550,Undeclared mustard in certain Continental Glatt Kosher brand Meat Products,2013-02-14,Mustard,Allergen,Class 1,Retail,"Alberta, Manitoba, Ontario, Quebec",Undeclared mustard in certain Continental Glatt Kosher,"Continental Strictly Kosher Meat, Poultry and Delicatessen Products Ltd.",Undeclared mustard in certain continental glatt kosher
2874,3551,Undeclared sulpites in various Rising Sun Farms brand dressing,2013-02-14,Sulpites,Allergen,Class 3,Retail,"Alberta, British Columbia, Manitoba, Ontario, Saskatchewan",Undeclared sulpites in various Rising Sun Farms,Terra International Food Inc.,Undeclared sulpites in various rising sun farms
2875,3552,Undeclared milk and egg in various products made by Unique Wonton Ltd.,2013-02-14,"Milk , egg",Allergen,Class 2,Retail,Ontario,,Unique Wonton Ltd.,Various products made by unique wonton ltd.
2876,3553,Undeclared mustard in Compliments brand Breaded Veal Cutlettes,2013-02-13,Mustard,Allergen,Class 1,Retail,Ontario,Undeclared mustard in Compliments,Delft Blue,Undeclared mustard in compliments
2877,3554,Undeclared egg and milk in various Unique Wonton brand products,2013-02-12,"Egg , milk",Allergen,Class 2,Retail,Ontario,Undeclared egg and milk in various Unique Wonton,Unique Wonton Ltd.,Undeclared egg and milk in various unique wonton
2878,3557,Undeclared fish in certain Something Special brand Gourmet Antipasto Vegetarian Tangy Vegetables,2013-02-11,Fish,Allergen,Class 1,Warehouse,"British Columbia, Ontario",Undeclared fish in certain Something Special,Something Special Deli-Foods Ltd.,Undeclared fish in certain something special
2879,3556,Undeclared EGG and MILK in YUM YUM FOOD brand SHRIMP WONTON and SHRIMP DUMPLING,2013-02-11,"Egg , milk",Allergen,Class 1,Retail,Ontario,Undeclared EGG and MILK in YUM YUM FOOD,Yum Yum Foods,Undeclared egg and milk in yum yum food
2880,3555,Undeclared sulphites in certain Rising Sun Farms brand Lemon Thyme Balsamic Dressing,2013-02-11,Sulphites,Allergen,Class 3,Retail,"Alberta, British Columbia, Manitoba, Ontario, Saskatchewan",Undeclared sulphites in certain Rising Sun Farms,Terra International Food Inc.,Undeclared sulphites in certain rising sun farms
2881,3558,Undeclared EGG and MILK in YUM YUM FOOD brand SUI MAI,2013-02-10,"Egg , milk",Allergen,Class 1,Consumer,Ontario,Undeclared EGG and MILK in YUM YUM FOOD,Yum Yum Foods,Undeclared egg and milk in yum yum food
